id,gender,masterCategory,subCategory,articleType,baseColour,season,year,usage,productDisplayName
33593,Men,Apparel,Topwear,Tshirts,White,Summer,2012.0,Casual,Wrangler Men Summer Throwdown White T-shirt
20191,Men,Apparel,Topwear,Tshirts,Grey,Fall,2011.0,Casual,Wrangler Men Grey Polo T-shirt
18646,Men,Apparel,Topwear,Shirts,Purple,Fall,2011.0,Casual,United Colors of Benetton Men Stripes Purple Shirt
34247,Men,Apparel,Topwear,Tshirts,Blue,Summer,2012.0,Casual,Proline Men Blue T-shirt with Printed Detail
1909,Men,Apparel,Topwear,Tshirts,Blue,Fall,2010.0,Sports,Nike Mens Classic Sportswear T-shirt
4330,Unisex,Apparel,Topwear,Tshirts,Blue,Summer,2011.0,Casual,Tantra Kid's Unisex Caution Blue Kidswear
33065,Men,Apparel,Topwear,Shirts,Brown,Summer,2012.0,Casual,U.S. Polo Assn. Denim Co. Men Brown Check Shirt
9982,Men,Apparel,Topwear,Tshirts,Blue,Fall,2011.0,Sports,Nike Men Blue Polo T-shirt
33968,Women,Apparel,Topwear,Shirts,Gold,Summer,2012.0,Casual,Femella Women Gold Shirt
8804,Men,Apparel,Topwear,Shirts,Red,Fall,2011.0,Casual,Scullers Men Scul White Gingham Red Shirt
20377,Women,Apparel,Topwear,Jackets,Pink,Fall,2011.0,Casual,Urban Yoga Women Solid Pink Jacket
58015,Women,Apparel,Topwear,Tops,White,Fall,2012.0,Casual,Latin Quarters Women Pink Printed Top
18716,Women,Apparel,Topwear,Tops,Black,Fall,2011.0,Casual,Arrow Woman Shanna Black Top
28645,Women,Apparel,Topwear,Tshirts,Black,Summer,2012.0,Sports,Nike Women Bleach Black T-shirt
34353,Men,Apparel,Topwear,Tshirts,Blue,Summer,2012.0,Casual,Myntra Men Blue Diet Extreme T-shirt
9832,Women,Apparel,Topwear,Tshirts,Orange,Fall,2011.0,Casual,Little Miss Women Printed Rust T-shirt
9071,Men,Apparel,Topwear,Shirts,White,Fall,2011.0,Formal,Mark Taylor Men Solid White Shirts
13936,Women,Apparel,Topwear,Shirts,Red,Summer,2011.0,Casual,United Colors of Benetton Women Printed Red Shirts
7961,Men,Apparel,Topwear,Tshirts,Blue,Fall,2011.0,Sports,Puma Men's Graphic Mood Indigo Navy T-shirt
4390,Men,Apparel,Topwear,Tshirts,White,Summer,2011.0,Casual,Free Authority Men's Retro Music White T-shirt
30597,Men,Apparel,Topwear,Tshirts,Red,Summer,2012.0,Sports,Nike Men Reversible Red T-shirt
10665,Men,Apparel,Topwear,Tshirts,Black,Fall,2011.0,Casual,Doodle Boy Extream Racer Black Tshirts
15470,Men,Apparel,Topwear,Tshirts,Red,Fall,2011.0,Casual,Puma Men Ferrari Logo Red Tshirts
36239,Women,Apparel,Topwear,Tops,Pink,Summer,2012.0,Casual,W Women Dark Pink Top
44690,Women,Apparel,Topwear,Tops,White,Summer,2012.0,Casual,Wills Lifestyle Women Multi Coloured Top
16033,Men,Apparel,Topwear,Shirts,Red,Fall,2011.0,Casual,Highlander Men Check Red Shirt
9423,Men,Apparel,Topwear,Shirts,Black,Fall,2011.0,Formal,John Miller Men Blue stripe Black Shirts
20318,Men,Apparel,Topwear,Shirts,Maroon,Summer,2011.0,Casual,Mother Earth Men Solid Maroon Shirt
19593,Women,Apparel,Topwear,Tops,Brown,Fall,2011.0,Casual,United Colors of Benetton Women Printed Brown Top
57427,Women,Apparel,Topwear,Tshirts,Green,Summer,2015.0,Casual,Angry Birds Women Green T-shirt
3707,Men,Apparel,Topwear,Tshirts,Purple,Summer,2011.0,Casual,Classic Polo Men's Purple Black & Cream Stripe T-shirt
14916,Men,Apparel,Topwear,Tshirts,White,Fall,2011.0,Casual,Mr. Men Men Be Happy White Tshirts
26266,Men,Apparel,Topwear,Tshirts,Brown,Summer,2012.0,Casual,Proline Men Brown Polo T-Shirt
28807,Men,Apparel,Topwear,Shirts,Brown,Summer,2012.0,Casual,Denizen Men Check Brown Shirt
7026,Men,Apparel,Topwear,Tshirts,Green,Summer,2011.0,Casual,Classic Polo Men's Combo Pack of 2 Purple Seaweed Green T-shirt
24091,Men,Apparel,Topwear,Tshirts,Navy Blue,Fall,2011.0,Casual,Manchester United Men Navy Blue Striped T-shirt
11436,Women,Apparel,Topwear,Tshirts,Peach,Fall,2011.0,Casual,United Colors of Benetton Women Light Winter Peach T-shirt
40132,Boys,Apparel,Topwear,Shirts,Red,Summer,2012.0,Casual,Gini and Jony Boys Authentic Red Shirt
27151,Men,Apparel,Topwear,Shirts,Blue,Summer,2012.0,Formal,Mark Taylor Men Striped Blue Shirt
4955,Men,Apparel,Topwear,Shirts,Red,Summer,2011.0,Casual,Gini and Jony Boy's Kaiser Red Blue Kidswear
4747,Men,Apparel,Topwear,Tshirts,Green,Summer,2011.0,Sports,ADIDAS Men's Green Polo T-shirt
14322,Men,Apparel,Topwear,Jackets,Black,Fall,2011.0,Sports,ADIDAS Men Solid Black Jackets
49659,Women,Apparel,Topwear,Tops,Green,Summer,2012.0,Casual,Mineral Women Green Top
8477,Women,Apparel,Topwear,Jackets,Blue,Fall,2011.0,Casual,Forever New Women Washed Blue Jacket
3751,Men,Apparel,Topwear,Tshirts,Blue,Summer,2011.0,Casual,Status Quo Men's Ticket To Win Blue T-shirt
17904,Men,Apparel,Topwear,Jackets,Navy Blue,Fall,2011.0,Sports,Nike Men Football Soccer Navy Blue Jacket
33186,Women,Apparel,Topwear,Tops,Purple,Summer,2012.0,Casual,Sepia Women Purple Top
28620,Men,Apparel,Topwear,Tshirts,Blue,Summer,2012.0,Sports,Nike Men Blue T-shirt
14748,Men,Apparel,Topwear,Shirts,White,Fall,2011.0,Formal,Arrow Men Solid White Shirts
8200,Men,Apparel,Topwear,Tshirts,Black,Summer,2011.0,Casual,Locomotive Men Solid Lander Black T-Shirts
59105,Men,Apparel,Topwear,Rain Jacket,Blue,Fall,2012.0,Casual,Just Natural Men Navy Blue Rain Jacket
16422,Men,Apparel,Topwear,Tshirts,Red,Fall,2011.0,Casual,Levi's Men Printed Red Tshirts
19581,Men,Apparel,Topwear,Tshirts,White,Summer,2011.0,Casual,United Colors of Benetton Men Printed White Tshirt
43698,Boys,Apparel,Topwear,Tshirts,Yellow,Summer,2012.0,Casual,Doodle Boys Printed Yellow T-shirt
8435,Women,Apparel,Topwear,Tops,Purple,Fall,2011.0,Casual,Jealous 21 Women Edie Purple Top
26231,Men,Apparel,Topwear,Tshirts,Yellow,Summer,2012.0,Casual,Proline Men Yellow Printed T-shirt
32641,Women,Apparel,Topwear,Tshirts,Orange,Summer,2012.0,Sports,Nike Women Orange Striped Polo T-shirt
4396,Men,Apparel,Topwear,Tshirts,Grey,Summer,2011.0,Casual,Free Authority Men's Foil Washed Grey T-shirt
7641,Men,Apparel,Topwear,Tshirts,White,Fall,2011.0,Sports,Puma Men's Slogan White T-shirt
48256,Boys,Apparel,Topwear,Tshirts,Navy Blue,Summer,2012.0,Casual,The Amazing Spiderman Boys Navy Blue T-shirt
1757,Men,Apparel,Topwear,Tshirts,Black,Fall,2010.0,Sports,Lotto Men Polo Slate Black Rugby T-shirt
11722,Men,Apparel,Topwear,Shirts,Red,Summer,2011.0,Casual,Lee Men Check Red Shirts
13497,Men,Apparel,Topwear,Tshirts,Blue,Fall,2011.0,Casual,Chimp Men Rajni Blue Tshirts
26479,Men,Apparel,Topwear,Tshirts,Black,Summer,2012.0,Casual,Puma Men Ferrari Black Polo T-shirt
14785,Men,Apparel,Topwear,Shirts,Navy Blue,Fall,2013.0,Formal,Arrow Men Stripes Navy Blue Shirts
18759,Women,Apparel,Topwear,Shirts,Blue,Fall,2011.0,Casual,Arrow Woman Aiyanna Blue Shirt
15986,Men,Apparel,Topwear,Shirts,Yellow,Fall,2011.0,Casual,Turtle Check Men Yellow Shirt
46403,Men,Apparel,Topwear,Tshirts,Olive,Summer,2012.0,Casual,ADIDAS Men Olive Printed T-shirt
17246,Men,Apparel,Topwear,Tshirts,Navy Blue,Fall,2011.0,Casual,U.S. Polo Assn. Men Stripes Navy Blue Polo Tshirt
14057,Men,Apparel,Topwear,Tshirts,Black,Fall,2011.0,Casual,Flying Machine Men Printed Black Polo Tshirts
16334,Men,Apparel,Topwear,Shirts,Peach,Fall,2011.0,Formal,Peter England Men Stripes Peach Shirt
5109,Women,Apparel,Topwear,Tops,Black,Summer,2011.0,Casual,Wrangler Women Long Polka White Red Top
34354,Men,Apparel,Topwear,Tshirts,Blue,Summer,2012.0,Casual,Myntra Men Blue T-shirt
23540,Men,Apparel,Topwear,Sweatshirts,Black,Fall,2011.0,Casual,Classic Polo Men Black Sweatshirt
18989,Men,Apparel,Topwear,Tshirts,Blue,Summer,2011.0,Casual,ADIDAS Originals Men AC Grp Blue Tshirt
36323,Boys,Apparel,Topwear,Tshirts,Green,Summer,2012.0,Casual,Mr.Men Boys Mr. Funny Green T-shirt
13962,Women,Apparel,Topwear,Tops,Pink,Fall,2011.0,Casual,Jealous 21 Women Printed Pink Tops
11717,Men,Apparel,Topwear,Shirts,Yellow,Summer,2011.0,Casual,Lee Men Check Yellow Shirts
4059,Men,Apparel,Topwear,Tshirts,Blue,Summer,2011.0,Casual,Myntra Men's I Am Tired Of Working Sky Blue T-shirt
32638,Men,Apparel,Topwear,Tshirts,Blue,Summer,2012.0,Sports,Nike Men Epaulet UV Crew Blue T-shirt
8353,Boys,Apparel,Topwear,Tshirts,White,Fall,2011.0,Casual,Doodle Boy's Original Royal Classic White Kidswear
16541,Men,Apparel,Topwear,Shirts,Black,Fall,2011.0,Casual,Basics Men Black Slim Fit Checked Shirt
31290,Women,Apparel,Topwear,Tshirts,Pink,Summer,2012.0,Casual,Puma Women Striped Pink T-shirt
8852,Men,Apparel,Topwear,Shirts,Grey,Fall,2011.0,Casual,Mark Taylor Men Grey Striped Shirt
48082,Men,Apparel,Topwear,Tshirts,White,Summer,2012.0,Casual,French Connection Men White T-shirt
19644,Women,Apparel,Topwear,Tops,Red,Fall,2011.0,Casual,United Colors of Benetton Women Red Top
16492,Men,Apparel,Topwear,Tshirts,Blue,Fall,2011.0,Casual,Locomotive Men Printed Blue TShirt
6552,Women,Apparel,Topwear,Tops,White,Summer,2011.0,Sports,Nike Women Aero White Top
16529,Men,Apparel,Topwear,Shirts,Yellow,Fall,2011.0,Casual,Locomotive Men Check Yellow Shirt
21578,Women,Apparel,Topwear,Tshirts,Green,Winter,2012.0,Casual,Roxy Women Green Garden T-Shirt
6910,Women,Apparel,Topwear,Tshirts,White,Summer,2011.0,Casual,Tantra Women's Rupee White T-shirt
54937,Women,Apparel,Topwear,Tshirts,Beige,Summer,2012.0,Casual,Do u speak green Women Beige T-shirt
14508,Men,Apparel,Topwear,Tshirts,Navy Blue,Fall,2011.0,Sports,ADIDAS Men Solid Navy Blue Jerseys
11103,Men,Apparel,Topwear,Shirts,Blue,Fall,2011.0,Formal,Indigo Nation Men Stripes Blue Shirts
8017,Men,Apparel,Topwear,Tshirts,White,Fall,2011.0,Sports,Fila Men's Round Neck Black White T-shirt
2683,Men,Apparel,Topwear,Tshirts,Red,Summer,2011.0,Casual,Inkfruit Men's Red And Black T-shirt
33964,Women,Apparel,Topwear,Shirts,Black,Summer,2012.0,Casual,Femella Women Black Shirt
3942,Women,Apparel,Topwear,Tshirts,Purple,Summer,2011.0,Casual,Jealous 21 Women's Purple T-shirt
11746,Men,Apparel,Topwear,Tshirts,Yellow,Summer,2011.0,Casual,Lee Men Yellow Polo T-shirt
37787,Men,Apparel,Topwear,Shirts,Blue,Summer,2012.0,Casual,John Players Men Blue Striped Shirt
5755,Women,Apparel,Topwear,Tops,Pink,Summer,2011.0,Casual,Jealous 21 Women Pink Graphic Top
59112,Men,Apparel,Topwear,Jackets,Olive,Summer,2012.0,Casual,Just Natural Men Olive Jacket
13157,Men,Apparel,Topwear,Tshirts,Black,Fall,2011.0,Casual,Puma Men Jersey Black Polo Tshirts
52030,Unisex,Apparel,Topwear,Rain Jacket,Olive,Summer,2012.0,,Just Natural Unisex Olive Rain Jacket
52078,Men,Apparel,Topwear,Tshirts,White,Summer,2012.0,Casual,Myntra Men White & Blue T-shirt
5751,Women,Apparel,Topwear,Tshirts,Green,Summer,2011.0,Casual,Jealous 21 Women's Green Angel T-shirt
26482,Men,Apparel,Topwear,Tshirts,Grey,Summer,2012.0,Casual,Puma Men Printed Grey T-shirt
31368,Men,Apparel,Topwear,Tshirts,White,Fall,2012.0,Casual,Locomotive White T-Shirt
9669,Men,Apparel,Topwear,Shirts,Blue,Fall,2011.0,Casual,Indigo Nation Men Checks Blue Shirts
3793,Men,Apparel,Topwear,Tshirts,Blue,Summer,2011.0,Casual,Basics Men Blue & Yellow Striped Polo T-shirt
24561,Men,Apparel,Topwear,Shirts,Blue,Summer,2012.0,Casual,Lee Men Smithon Blue Shirt
32433,Men,Apparel,Topwear,Tshirts,White,Summer,2012.0,Casual,ADIDAS Men White Polo T-shirt
9425,Men,Apparel,Topwear,Shirts,Purple,Fall,2011.0,Formal,John Miller Men Purple Fila-Fil Shirts
4723,Girls,Apparel,Topwear,Tshirts,Blue,Summer,2011.0,Casual,Disney Kids Girl's Jeans Blue Teen Kidswear
41303,Boys,Apparel,Topwear,Shirts,Navy Blue,Summer,2012.0,Casual,Gini and Jony Boys Navy Blue Shirt
32505,Men,Apparel,Topwear,Shirts,Black,Summer,2012.0,Casual,Scullers Men Black Shirt
28805,Men,Apparel,Topwear,Shirts,Blue,Summer,2012.0,Casual,Denizen Men Check Blue Shirt
3544,Men,Apparel,Topwear,Tshirts,White,Summer,2011.0,Casual,Myntra Men's Turn me on White T-shirt
15185,Men,Apparel,Topwear,Sweaters,Black,Fall,2011.0,Casual,Arrow Sport Men Solid Black Sweaters
44867,Men,Apparel,Topwear,Tshirts,Green,Summer,2012.0,Casual,Puma Men Green Graphic Story T-shirt
12769,Women,Apparel,Topwear,Tops,Red,Fall,2011.0,Ethnic,Mother Earth Women Checks Red Shirts
9969,Men,Apparel,Topwear,Tshirts,Navy Blue,Fall,2011.0,Sports,Nike Men As Kobe Hunt Navy Blue T-Shirts
7756,Men,Apparel,Topwear,Tshirts,Black,Fall,2011.0,Casual,Indigo Nation Men Indigo Black Grey Silver T-shirt
7208,Women,Apparel,Topwear,Tops,White,Fall,2011.0,Casual,Jealous 21 Women's Flower Printed White Top
6001,Men,Apparel,Topwear,Shirts,Grey,Summer,2011.0,Casual,Highlander Men Grey Red Checked Slim Fit Shirt
32963,Men,Apparel,Topwear,Tshirts,Blue,Summer,2012.0,Casual,Angry Birds Men Printed Blue T-shirt
34373,Men,Apparel,Topwear,Tshirts,Orange,Summer,2012.0,Casual,Myntra Men Orange Banana T-shirt
5791,Women,Apparel,Topwear,Tops,Blue,Summer,2011.0,Casual,Jealous 21 Women's Butterfly Blue Top
4924,Women,Apparel,Topwear,Tops,White,Summer,2011.0,Casual,Gini and Jony Girl's Velia White Peach Infant Kidswear
7294,Men,Apparel,Topwear,Tshirts,Yellow,Summer,2011.0,Casual,Free Authority Men's Tattoo Gun Lime Yellow T-shirt
16502,Men,Apparel,Topwear,Tshirts,Navy Blue,Fall,2011.0,Casual,Locomotive Men Solid Navy Blue Polo TShirt
48361,Men,Apparel,Topwear,Shirts,Blue,Summer,2012.0,Casual,French Connection Men Blue Shirt
31784,Women,Apparel,Topwear,Tops,Red,Summer,2012.0,Casual,Lee Women Katie Red Top
25504,Boys,Apparel,Topwear,Tshirts,Blue,Fall,2011.0,Casual,Doodle Kids Boys Soccer Blue T-Shirt
20138,Women,Apparel,Topwear,Shirts,Navy Blue,Fall,2011.0,Casual,Wrangler Women Puff Navy Blue Shirt
57108,Women,Apparel,Topwear,Tops,White,Summer,2012.0,Casual,Elle Women White Top
6216,Men,Apparel,Topwear,Tshirts,Black,Summer,2011.0,Casual,Lee Men's Printed Black T-shirt
26919,Women,Apparel,Topwear,Tops,Purple,Summer,2012.0,Casual,Jealous 21 Women Purple Top
42117,Men,Apparel,Topwear,Tshirts,Grey,Summer,2012.0,Casual,ADIDAS Men Grey T-shirt
14736,Men,Apparel,Topwear,Shirts,White,Fall,2011.0,Formal,Arrow Men Solid White Shirts
24528,Men,Apparel,Topwear,Shirts,White,Fall,2011.0,Casual,Mother Earth Men White Shirt
34220,Men,Apparel,Topwear,Tshirts,Red,Summer,2013.0,Casual,Proline Red Polo T-shirt
13452,Women,Apparel,Topwear,Shirts,Green,Summer,2011.0,Casual,United Colors of Benetton Women Check Green Shirts
46384,Men,Apparel,Topwear,Tshirts,Black,Summer,2012.0,Casual,ADIDAS Men Black Printed T-shirt
11049,Men,Apparel,Topwear,Shirts,Red,Fall,2011.0,Casual,Scullers Men Check Red Shirts
3878,Men,Apparel,Topwear,Tshirts,Black,Summer,2011.0,Casual,Wrangler Men's Reverse Print Charcoal T-shirt
9065,Men,Apparel,Topwear,Shirts,Blue,Fall,2011.0,Formal,Mark Taylor Men Blue Striped Shirt
12241,Men,Apparel,Topwear,Shirts,White,Fall,2011.0,Formal,Genesis Men Stripes White Shirts
44850,Men,Apparel,Topwear,Tshirts,Black,Summer,2012.0,Casual,Puma Men Black Ferrari Logo T-shirt
15696,Men,Apparel,Topwear,Shirts,White,Fall,2011.0,Formal,Black coffee Men George White Shirts
39865,Boys,Apparel,Topwear,Tshirts,Red,Summer,2012.0,Casual,Gini and Jony Boys Polo Red T-Shirt
5427,Boys,Apparel,Topwear,Tshirts,Red,Summer,2011.0,Casual,Ant Kids Boy's Red Cartoon Pop Kidswear
34032,Boys,Apparel,Topwear,Shirts,Green,Summer,2012.0,Casual,Gini and Jony Boys Check Green Shirt
3534,Women,Apparel,Topwear,Tshirts,Black,Summer,2011.0,Casual,Myntra Women's I Want You Black T-shirt
15170,Men,Apparel,Topwear,Tshirts,Maroon,Fall,2011.0,Casual,Arrow Sport Men Stripes Maroon Polo Tshirts
12296,Men,Apparel,Topwear,Shirts,Red,Fall,2011.0,Formal,Genesis Men Red Striped Shirt
2138,Men,Apparel,Topwear,Shirts,Green,Spring,2011.0,Casual,Basics Men Green & Cream Slim Fit Shirt
11359,Women,Apparel,Topwear,Tshirts,Grey,Fall,2011.0,Casual,United Colors Of Benetton Women Light Winter Grey T-Shirts
11016,Women,Apparel,Topwear,Tops,Pink,Fall,2011.0,Casual,Wrangler Women Floral Print Pink Top
30340,Men,Apparel,Topwear,Tshirts,Off White,Summer,2012.0,Casual,Myntra Men Ego Off White T-shirt
6084,Men,Apparel,Topwear,Tshirts,White,Summer,2011.0,Casual,UCB Men's Johny Collar With Two Tone White T-shirt
7142,Women,Apparel,Topwear,Shirts,Purple,Fall,2011.0,Casual,Scullers For Her Women Light Work Purple Check Shirts
11772,Men,Apparel,Topwear,Tshirts,Black,Fall,2011.0,Casual,Lee Men Black Printed T-shirt
34094,Girls,Apparel,Topwear,Tops,Lime Green,Summer,2012.0,Casual,Doodle Girls Printed Lime Green Top
1890,Men,Apparel,Topwear,Tshirts,Red,Winter,2010.0,Casual,FIFA Mens Essentials Red T-shirt
28932,Men,Apparel,Topwear,Tshirts,Blue,Summer,2012.0,Casual,Mr. Men Printed Blue T-shirt
6200,Men,Apparel,Topwear,Tshirts,White,Summer,2011.0,Casual,UCB Men's Small Square Print White T-shirt
1947,Men,Apparel,Topwear,Tshirts,Blue,Fall,2010.0,Sports,Puma Mens Cricket Way of Life T-shirt
44896,Men,Apparel,Topwear,Tshirts,Blue,Summer,2012.0,Casual,Puma Men Blue Polo Neck T-shirt
16130,Women,Apparel,Topwear,Tops,Pink,Fall,2011.0,Casual,Tokyo Talkies Women Printed Pink Top
34112,Girls,Apparel,Topwear,Tops,White,Summer,2012.0,Casual,Doodle Girls Printed White Top
40143,Girls,Apparel,Topwear,Tops,Blue,Summer,2012.0,Casual,Gini and Jony Girls Pretty Blossom Blue Top
17190,Men,Apparel,Topwear,Shirts,Navy Blue,Winter,2016.0,Casual,U.S. Polo Assn. Men Checks Navy Blue Shirt
58498,Women,Apparel,Topwear,Tops,White,Summer,2012.0,Casual,Tonga Women Printed White Top
12179,Men,Apparel,Topwear,Shirts,White,Fall,2011.0,Casual,Basics Men White Slim Fit Striped Shirt
4749,Men,Apparel,Topwear,Tshirts,Red,Summer,2011.0,Casual,ADIDAS Men's Polo Red Polo T-shirt
3339,Men,Apparel,Topwear,Tshirts,White,Summer,2011.0,Casual,Myntra Hero Within White T-shirt
13155,Men,Apparel,Topwear,Tshirts,Blue,Fall,2011.0,Casual,Puma Men Vintage No.1 Logo Blue Tshirts
26866,Women,Apparel,Topwear,Tshirts,White,Summer,2012.0,Casual,Jealous 21 Women Printed White T-shirt
38948,Girls,Apparel,Topwear,Tops,Pink,Summer,2012.0,Casual,Gini and Jony Girls Printed Pink Top
10878,Men,Apparel,Topwear,Tshirts,Red,Fall,2011.0,Casual,Wrangler Men Red Polo Tshirts
3087,Men,Apparel,Topwear,Tshirts,Navy Blue,Summer,2011.0,Casual,Probase Mens  T-shirt
10641,Men,Apparel,Topwear,Tshirts,Red,Fall,2011.0,Casual,Doodle Boy D Print Red T-shirt
43312,Women,Apparel,Topwear,Sweaters,Blue,Summer,2012.0,Casual,United Colors of Benetton Women Blue Sweater
38581,Men,Apparel,Topwear,Tshirts,Red,Summer,2012.0,Casual,Nike Men Red T-shirt
3684,Men,Apparel,Topwear,Tshirts,Navy Blue,Summer,2011.0,Casual,Inkfruit Men's Into The Wild Navy T-shirt
10068,Men,Apparel,Topwear,Tshirts,White,Fall,2011.0,Casual,Puma Men lifestyle graphitti White Tshirts
13422,Men,Apparel,Topwear,Tshirts,White,Summer,2011.0,Casual,United Colors of Benetton Men Solid White Polo T-shirts
4052,Men,Apparel,Topwear,Tshirts,Black,Summer,2011.0,Casual,Myntra Men's Eagle Emblem Black T-shirt
14988,Men,Apparel,Topwear,Sweatshirts,Grey,Fall,2011.0,Casual,ADIDAS Men Solid Grey Sweatshirts
11728,Men,Apparel,Topwear,Tshirts,Red,Summer,2011.0,Casual,Lee Men Solid Red Tshirts
24943,Girls,Apparel,Topwear,Tshirts,White,Summer,2012.0,Casual,United Colors of Benetton Kids Girls White T-shirt
21235,Men,Apparel,Topwear,Shirts,Red,Fall,2011.0,Casual,Highlander Men Red Check Shirt
5943,Men,Apparel,Topwear,Shirts,Green,Summer,2011.0,Casual,Locomotive Men Green Checked Shirt
24529,Men,Apparel,Topwear,Shirts,Beige,Fall,2011.0,Casual,Mother Earth Men Beige Shirt
3125,Men,Apparel,Topwear,Tshirts,Black,Summer,2011.0,Casual,Inkfruit Men's Star War Black T-shirt
16419,Men,Apparel,Topwear,Tshirts,Green,Fall,2011.0,Casual,Levi's Men Stripes Green Tshirts
28553,Men,Apparel,Topwear,Tshirts,Navy Blue,Summer,2012.0,Casual,Nike Men Pique Navy Blue T-shirt
1760,Men,Apparel,Topwear,Tshirts,White,Fall,2010.0,Sports,Lotto Men Marcello White T-shirt
48075,Men,Apparel,Topwear,Tshirts,Turquoise Blue,Summer,2012.0,Casual,French Connection Men Blue T-shirt
34010,Girls,Apparel,Topwear,Tops,Black,Summer,2012.0,Casual,Gini and Jony Girls Black Top
5120,Women,Apparel,Topwear,Tshirts,Navy Blue,Summer,2011.0,Casual,Wrangler Women's Feel Good Navy Blue T-shirt
37094,Men,Apparel,Topwear,Tshirts,Blue,Summer,2012.0,Casual,Wills Sport Men Navy Blue and Pink Striped T-shirt
31289,Men,Apparel,Topwear,Tshirts,White,Summer,2012.0,Casual,Puma Men Training Polo White T-shirt
38596,Men,Apparel,Topwear,Tshirts,Black,Summer,2012.0,Casual,Nike Men Printed Texture Black T-shirt
7865,Men,Apparel,Topwear,Tshirts,Black,Fall,2011.0,Casual,Proline Men Black Printed Polo T-shirt
11783,Men,Apparel,Topwear,Tshirts,Grey,Summer,2011.0,Casual,Lee Men Printed Grey Tshirts
43330,Women,Apparel,Topwear,Tshirts,Yellow,Summer,2012.0,Casual,United Colors of Benetton Women Yellow Top
29629,Men,Apparel,Topwear,Shirts,Black,Summer,2012.0,Formal,Indigo Nation Men Check Black Shirt
34365,Men,Apparel,Topwear,Tshirts,Blue,Summer,2012.0,Casual,Myntra Men Blue Jazzy Moves T-shirt
57981,Women,Apparel,Topwear,Shirts,Red,Summer,2010.0,Casual,Latin Quarters Women Red Check Shirt
41988,Boys,Apparel,Topwear,Shirts,Blue,Summer,2012.0,Casual,Gini and Jony Boys Check Blue Shirt
41301,Girls,Apparel,Topwear,Tshirts,Pink,Summer,2012.0,Casual,Gini and Jony Grils Polo Striped Pink T-shirt
13754,Men,Apparel,Topwear,Shirts,White,Fall,2011.0,Formal,Belmonte Men Stripes White Shirts
54940,Women,Apparel,Topwear,Tshirts,Burgundy,Summer,2012.0,Casual,Do u speak green Women Burgundy T-shirt
2484,Women,Apparel,Topwear,Tshirts,White,Fall,2010.0,Sports,Puma Women Spagetti White Top
1812,Men,Apparel,Topwear,Tshirts,Green,Fall,2010.0,Sports,Solognac Men Green T-shirt
2322,Women,Apparel,Topwear,Tshirts,White,Fall,2010.0,Sports,Nike Womens Luck White T-shirt
57100,Women,Apparel,Topwear,Tops,Pink,Summer,2012.0,Casual,Elle Women Dark Pink Top
11743,Men,Apparel,Topwear,Tshirts,Green,Fall,2011.0,Casual,Lee Men Green Polo Tshirts
40436,Women,Apparel,Topwear,Tops,Black,Summer,2012.0,Casual,Tonga Women Black & White Printed Top
6879,Women,Apparel,Topwear,Tops,Peach,Summer,2011.0,Casual,Forever New Women Peach Floral Lace Neckline Peach Top
20340,Men,Apparel,Topwear,Tshirts,Grey,Summer,2011.0,Casual,Probase Men Printed Grey Tshirt
27213,Men,Apparel,Topwear,Shirts,Blue,Summer,2012.0,Casual,Doodle Kids Boy Check Blue Shirt
40018,Men,Apparel,Topwear,Tshirts,Black,Spring,2013.0,Casual,ADIDAS Men Black T-shirt
34219,Men,Apparel,Topwear,Tshirts,Sea Green,Summer,2013.0,Casual,Proline Sea Green Polo T-shirt
5188,Men,Apparel,Topwear,Tshirts,Black,Summer,2011.0,Casual,Linkin Park Men's Linking Black T-shirt
10418,Women,Apparel,Topwear,Tops,Black,Fall,2011.0,Casual,United Colors of Benetton Women Solid Black Tops
3451,Men,Apparel,Topwear,Tshirts,White,Fall,2010.0,Sports,ADIDAS Men's Delhi Daredevils Graphic White T-shirt
3967,Women,Apparel,Topwear,Tops,Pink,Summer,2011.0,Casual,Jealous 21 Women Pink & Beige Long Top
24947,Girls,Apparel,Topwear,Tops,Red,Summer,2012.0,Casual,United Colors of Benetton Kids Girls Red Printed Top
6083,Women,Apparel,Topwear,Tshirts,Pink,Summer,2011.0,Casual,UCB Women's Halftone Print Pink T-shirt
11297,Men,Apparel,Bottomwear,Jeans,Blue,Fall,2011.0,Casual,Wrangler Men Blue Custom Jeans
30605,Men,Apparel,Bottomwear,Track Pants,Grey,Summer,2012.0,Casual,Nike Men Classic Jersey Grey Track Pants
2558,Women,Apparel,Bottomwear,Track Pants,Black,Summer,2011.0,Casual,Domyos Women Trompette Track Pant
32585,Women,Apparel,Bottomwear,Trousers,Black,Summer,2012.0,Casual,Only  Women Black Trousers
48097,Women,Apparel,Bottomwear,Trousers,Green,Winter,2011.0,Casual,French Connection Women Green Trousers
14657,Men,Apparel,Bottomwear,Trousers,Grey,Fall,2011.0,Casual,Probase Men Solid DK.Grey Trousers
27215,Men,Apparel,Bottomwear,Shorts,Blue,Summer,2012.0,Casual,Doodle Kids Boy Striped Blue Shorts
50956,Women,Apparel,Bottomwear,Jeans,Black,Summer,2013.0,Casual,Lee Women Black Jeans
4949,Men,Apparel,Bottomwear,Shorts,Blue,Summer,2011.0,Casual,Gini and Jony Boy's Kimon Blue Bermuda Kidswear
15631,Men,Apparel,Bottomwear,Track Pants,Navy Blue,Winter,2014.0,Sports,Nike Men Navy Cricket Track Pants
30411,Men,Apparel,Bottomwear,Jeans,Blue,Summer,2012.0,Casual,Deni Yo Men Slim Fit Washed Blue Jeans
2579,Women,Apparel,Bottomwear,Shorts,Blue,Summer,2011.0,Sports,Domyos Women's Blue Short
4825,Men,Apparel,Bottomwear,Track Pants,Grey,Summer,2011.0,Sports,ADIDAS Men's Woven Lead White Track Pant
10018,Men,Apparel,Bottomwear,Shorts,Black,Fall,2012.0,Sports,Nike Men Black Three Quarter Track Pants
41961,Boys,Apparel,Bottomwear,Jeans,Navy Blue,Summer,2012.0,Casual,Gini and Jony Boys Raw Wash Navy Blue Jeans
44304,Men,Apparel,Bottomwear,Shorts,Grey,Summer,2012.0,Casual,Indian Terrain Men Grey Shorts
11349,Men,Apparel,Bottomwear,Jeans,Blue,Summer,2017.0,Casual,Lee Men Blue Chicago Fit Jeans
39797,Men,Apparel,Bottomwear,Trousers,Black,Summer,2012.0,Formal,Peter England Men Black Formal Trousers
3542,Men,Apparel,Bottomwear,Shorts,Black,Summer,2011.0,Sports,ADIDAS Men's Black Short
27917,Women,Apparel,Bottomwear,Trousers,Brown,Summer,2012.0,Formal,Scullers For Her Brown Striped Trousers
48462,Men,Apparel,Bottomwear,Shorts,Blue,Summer,2012.0,Casual,French Connection Men Blue Denim Shorts
13304,Women,Apparel,Bottomwear,Skirts,Red,Fall,2011.0,Casual,Gini and Jony Kids Girls Solid Red Skirts
42104,Men,Apparel,Bottomwear,Shorts,Navy Blue,Spring,2013.0,Casual,ADIDAS Men Navy Blue Shorts
28811,Men,Apparel,Bottomwear,Jeans,Blue,Summer,2012.0,Casual,Denizen Men Blue Jeans
27626,Men,Apparel,Bottomwear,Shorts,Brown,Summer,2012.0,Casual,Scullers Men Check Brown Cargo Shorts
12218,Men,Apparel,Bottomwear,Trousers,Beige,Fall,2011.0,Formal,Basics Men Solid Beige Trousers
51502,Women,Apparel,Bottomwear,Jeans,Blue,Summer,2012.0,Casual,Denizen Women Greenish Blue Jeans
49956,Men,Apparel,Bottomwear,Shorts,Black,Summer,2016.0,Casual,Hanes Men Black Panelled 3/4th Pants
37558,Girls,Apparel,Bottomwear,Shorts,Pink,Summer,2012.0,Casual,Madagascar3 Girls Pink Shorts
32250,Women,Apparel,Bottomwear,Skirts,Blue,Summer,2012.0,Ethnic,Fabindia Women Blue Skirts
28627,Men,Apparel,Bottomwear,Shorts,Black,Summer,2012.0,Sports,Nike Men Longer Knit Black Shorts
11235,Women,Apparel,Bottomwear,Jeans,Blue,Fall,2011.0,Casual,Flying Machine Women Midrise Blue Jeans
32457,Men,Apparel,Bottomwear,Shorts,Black,Spring,2013.0,Sports,ADIDAS Men Black Shorts
9854,Men,Apparel,Bottomwear,Trousers,Black,Fall,2011.0,Formal,Indian Terrain Men Laffer Black Trousers
31014,Men,Apparel,Bottomwear,Trousers,Black,Summer,2013.0,Formal,Arrow Men Black Trousers
